{
  "$schema": "https://json-schema.org/draft/2020-12/schema",
  "$id": "openmontage/artifacts/product_facts",
  "title": "Product Facts",
  "description": "产品事实卡：生产前由用户填写的 SKU/价格/参数权威值（带出处），喂给 technical_validator 的 expected_facts，使 L1a 事实类检查从 skip 变为 pass。跳过时只填 product_name + filled_by 即可。",
  "type": "object",
  "required": ["version", "product_name"],
  "properties": {
    "version": { "type": "string", "const": "1.0" },
    "product_name": { "type": "string", "minLength": 1 },
    "product_id": { "type": "string", "minLength": 1 },
    "sku": { "type": "string", "description": "商品编号/型号（如 TM-2mm）" },
    "price": { "type": "string", "description": "价格（如 49.9元 / ¥49.9）" },
    "params": {
      "type": "array",
      "items": { "type": "string" },
      "description": "关键参数的自然语言表述列表（如 厚度 2mm）"
    },
    "provenance": {
      "type": "object",
      "additionalProperties": { "type": "string" },
      "description": "每项事实的出处（sku/price/params -> 用户填写 / 商品页 / 官方）"
    },
    "visual_identity": {
      "type": "object",
      "properties": {
        "must_preserve": {
          "type": "array",
          "items": { "type": "string" },
          "description": "必须保留的视觉真实性（如 包装颜色、logo、产品形态）"
        },
        "allowed_variation": {
          "type": "array",
          "items": { "type": "string" },
          "description": "允许的视觉变化（如 角度、景别、光照）"
        },
        "forbidden": {
          "type": "array",
          "items": { "type": "string" },
          "description": "禁止的视觉表达（如 变色、变形、遮挡 logo）"
        }
      },
      "additionalProperties": false,
      "description": "产品视觉真实性约束（ProductBible）"
    },
    "claims": {
      "type": "array",
      "items": {
        "type": "object",
        "required": ["claim", "status"],
        "properties": {
          "claim": { "type": "string", "minLength": 1, "description": "产品主张（如 0甲醛）" },
          "claim_id": { "type": "string", "minLength": 1 },
          "statement": { "type": "string", "minLength": 1 },
          "claim_class": { "enum": ["identity", "feature", "advantage", "benefit", "evidence"] },
          "status": {
            "type": "string",
            "enum": ["authorized", "needs_evidence", "forbidden"],
            "description": "authorized=可直接声称 / needs_evidence=仅在有证据时声称 / forbidden=禁止声称"
          },
          "evidence": { "type": "string", "description": "证据出处（如 检测报告/画面实测）" }
          ,"evidence_status": { "enum": ["page_claim", "visually_observed", "qualified_report", "needs_human_confirmation", "restricted", "forbidden"] }
          ,"sku_scope": { "type": "array", "minItems": 1, "uniqueItems": true, "items": {"type": "string", "minLength": 1} }
          ,"provenance_refs": { "type": "array", "uniqueItems": true, "items": {"type": "string", "minLength": 1} }
          ,"product_page_refs": { "type": "array", "uniqueItems": true, "items": {"type": "string", "pattern": "^product_page_capture\\.fact_candidates\\[[0-9]+\\]$"} }
          ,"page_asset_ids": { "type": "array", "uniqueItems": true, "items": {"type": "string", "minLength": 1} }
          ,"page_evidence_ids": { "type": "array", "uniqueItems": true, "items": {"type": "string", "minLength": 1} }
          ,"required_visual_evidence": { "type": "array", "uniqueItems": true, "items": {"type": "string", "minLength": 1} }
          ,"allowed_wording": { "type": "array", "uniqueItems": true, "items": {"type": "string", "minLength": 1} }
          ,"prohibited_wording": { "type": "array", "uniqueItems": true, "items": {"type": "string", "minLength": 1} }
          ,"risk_level": { "enum": ["low", "medium", "high"] }
        },
        "additionalProperties": false
      },
      "description": "产品主张清单（含可声称边界）"
    },
    "filled_by": { "type": "string", "description": "填写人（user / agent / skipped）" },
    "filled_at": { "type": "string", "format": "date-time" },
    "semantic_sha256": { "type": "string" },
    "artifact_sha256": { "type": "string" }
  },
  "additionalProperties": false
}
