{"version":"1.0","product_name":"透明桌垫","sku":"TPU桌垫","price":"69元","params":["透明极简","防水防油","0甲醛"],"claims":[{"claim":"0甲醛","status":"needs_evidence","evidence":"检测报告"},{"claim":"全网最低价","status":"forbidden"}],"visual_identity":{"must_preserve":["透明材质","无 logo 遮挡"],"forbidden":["变色","变形"]},"provenance":{"sku":"用户填写","price":"用户填写","claims":"官方/检测报告"},"filled_by":"user","filled_at":"2026-08-25T00:00:00+00:00","semantic_sha256":"1814457cf331f4bf8b71074ad2b9110a23822203c86303bcbfd3db284b46db0c","artifact_sha256":"61fca1bf15c2ac9a3c6e68f4ffd206a4b85e3b979c4022a58e5463bcafe41f6d"}